{
  "schema_version": 1,
  "module_id": "module-03",
  "event_id": "6f1c2c4e-6b1a-4f2e-9b3d-1a2b3c4d5e6f",
  "kind": "low_voltage",
  "severity": "warning",
  "message": "5V por debajo de 4.6V durante 200ms",
  "device": {
    "boot_id": "9c4f5f71-9e4d-4c5b-ae60-4d5e6f708192",
    "uptime_us": 1832456789,
    "event_us": 1832456712
  },
  "detail": {
    "voltage_5v_mv": 4550,
    "duration_ms": 200
  },
  "firmware_version": "0.1.0"
}
